{
  "avatar": {
    "artifact_path": "config/products/siroino-heather-hooded-bodysuit/spec/legacy-source-index.v1.json",
    "confidence": 0.0,
    "content_sha256": "8b672eb19fdc4dbce80d5c66ae4012891bdbe86d9beaff3fbcc8a76ccf7e517a",
    "evidence": [],
    "hypothesis_id": "legacy-migration",
    "schema_version": 1,
    "section_id": "avatar"
  },
  "construction": {
    "artifact_path": "config/products/siroino-heather-hooded-bodysuit/spec/legacy-source-index.v1.json",
    "confidence": 0.0,
    "content_sha256": "8b672eb19fdc4dbce80d5c66ae4012891bdbe86d9beaff3fbcc8a76ccf7e517a",
    "evidence": [],
    "hypothesis_id": "legacy-migration",
    "schema_version": 1,
    "section_id": "construction"
  },
  "coordinate_system": "right-handed-z-up",
  "extensions": {
    "image2outfit.migration": {
      "completionIssues": [140, 141, 142, 143, 144, 145],
      "status": "legacy-source-index"
    }
  },
  "fit": {
    "artifact_path": "config/products/siroino-heather-hooded-bodysuit/spec/legacy-source-index.v1.json",
    "confidence": 0.0,
    "content_sha256": "8b672eb19fdc4dbce80d5c66ae4012891bdbe86d9beaff3fbcc8a76ccf7e517a",
    "evidence": [],
    "hypothesis_id": "legacy-migration",
    "schema_version": 1,
    "section_id": "fit"
  },
  "garment_id": "siroino-heather-hooded-bodysuit",
  "hypothesis_id": "legacy-migration",
  "materials": {
    "artifact_path": "config/products/siroino-heather-hooded-bodysuit/spec/legacy-source-index.v1.json",
    "confidence": 0.0,
    "content_sha256": "8b672eb19fdc4dbce80d5c66ae4012891bdbe86d9beaff3fbcc8a76ccf7e517a",
    "evidence": [],
    "hypothesis_id": "legacy-migration",
    "schema_version": 1,
    "section_id": "materials"
  },
  "parent_hypothesis_id": null,
  "provenance": {
    "evidence": [],
    "producer": "image2outfit-migration",
    "source_reference": "config/products/siroino-heather-hooded-bodysuit/spec/legacy-source-index.v1.json",
    "source_sha256": "8b672eb19fdc4dbce80d5c66ae4012891bdbe86d9beaff3fbcc8a76ccf7e517a"
  },
  "quality": {
    "artifact_path": "config/products/siroino-heather-hooded-bodysuit/spec/legacy-source-index.v1.json",
    "confidence": 0.0,
    "content_sha256": "8b672eb19fdc4dbce80d5c66ae4012891bdbe86d9beaff3fbcc8a76ccf7e517a",
    "evidence": [],
    "hypothesis_id": "legacy-migration",
    "schema_version": 1,
    "section_id": "quality"
  },
  "schema_version": 1,
  "styling": {
    "artifact_path": "config/products/siroino-heather-hooded-bodysuit/spec/legacy-source-index.v1.json",
    "confidence": 0.0,
    "content_sha256": "8b672eb19fdc4dbce80d5c66ae4012891bdbe86d9beaff3fbcc8a76ccf7e517a",
    "evidence": [],
    "hypothesis_id": "legacy-migration",
    "schema_version": 1,
    "section_id": "styling"
  },
  "unit_system": "millimetre"
}
